Repo_ID,Name_new,Stars_new,License_new,URL_new,Description_new,Created_At_new,Updated_At_new,Grabbed_At_new,Name_old,Stars_old,License_old,URL_old,Description_old,Created_At_old,Updated_At_old,Grabbed_At_old
1106996539,nextlevelbuilder/ui-ux-pro-max-skill,24347,mit,https://github.com/nextlevelbuilder/ui-ux-pro-max-skill,An AI SKILL that provide design intelligence for building professional UI/UX multiple platforms,2025-11-30 19:36:31,2026-01-28 21:29:06,2026-01-28 21:31:12,nextlevelbuilder/ui-ux-pro-max-skill,24344,mit,https://github.com/nextlevelbuilder/ui-ux-pro-max-skill,An AI SKILL that provide design intelligence for building professional UI/UX multiple platforms,2025-11-30 19:36:31,2026-01-28 21:15:28,2026-01-28 21:23:30
1127110039,OthmanAdi/planning-with-files,11656,mit,https://github.com/OthmanAdi/planning-with-files,Claude Code skill implementing Manus-style persistent markdown planning — the workflow pattern behind the $2B acquisition.,2026-01-03 15:37:28,2026-01-28 21:28:24,2026-01-28 21:31:12,OthmanAdi/planning-with-files,11654,mit,https://github.com/OthmanAdi/planning-with-files,Claude Code skill implementing Manus-style persistent markdown planning — the workflow pattern behind the $2B acquisition.,2026-01-03 15:37:28,2026-01-28 21:23:13,2026-01-28 21:23:30
1078319457,yusufkaraaslan/Skill_Seekers,8296,mit,https://github.com/yusufkaraaslan/Skill_Seekers,"Convert documentation websites, GitHub repositories, and PDFs into Claude AI skills with automatic conflict detection",2025-10-17 22:43:48,2026-01-28 21:28:27,2026-01-28 21:31:12,yusufkaraaslan/Skill_Seekers,8292,mit,https://github.com/yusufkaraaslan/Skill_Seekers,"Convert documentation websites, GitHub repositories, and PDFs into Claude AI skills with automatic conflict detection",2025-10-17 22:43:48,2026-01-28 21:23:03,2026-01-28 21:23:30
1120349776,muratcankoylan/Agent-Skills-for-Context-Engineering,7894,mit,https://github.com/muratcankoylan/Agent-Skills-for-Context-Engineering,"A comprehensive collection of Agent Skills for context engineering, multi-agent architectures, and production agent systems. Use when building, optimizing, or debugging agent systems that require effective context management.",2025-12-21 10:43:42,2026-01-28 21:30:58,2026-01-28 21:31:12,muratcankoylan/Agent-Skills-for-Context-Engineering,7893,mit,https://github.com/muratcankoylan/Agent-Skills-for-Context-Engineering,"A comprehensive collection of Agent Skills for context engineering, multi-agent architectures, and production agent systems. Use when building, optimizing, or debugging agent systems that require effective context management.",2025-12-21 10:43:42,2026-01-28 19:49:43,2026-01-28 21:23:30
1079456184,K-Dense-AI/claude-scientific-skills,7347,mit,https://github.com/K-Dense-AI/claude-scientific-skills,A set of ready to use scientific skills for Claude,2025-10-20 04:54:15,2026-01-28 21:26:44,2026-01-28 21:31:12,K-Dense-AI/claude-scientific-skills,7345,mit,https://github.com/K-Dense-AI/claude-scientific-skills,A set of ready to use scientific skills for Claude,2025-10-20 04:54:15,2026-01-28 21:09:04,2026-01-28 21:23:30
1134426800,sickn33/antigravity-awesome-skills,4727,mit,https://github.com/sickn33/antigravity-awesome-skills,"The Ultimate Collection of 200+ Agentic Skills for Claude Code/Antigravity/Cursor. Battle-tested, high-performance skills for AI agents including official skills from Anthropic and Vercel.",2026-01-15 01:48:09,2026-01-28 21:29:24,2026-01-28 21:31:12,sickn33/antigravity-awesome-skills,4724,mit,https://github.com/sickn33/antigravity-awesome-skills,"The Ultimate Collection of 200+ Agentic Skills for Claude Code/Antigravity/Cursor. Battle-tested, high-performance skills for AI agents including official skills from Anthropic and Vercel.",2026-01-15 01:48:09,2026-01-28 21:22:29,2026-01-28 21:23:30
1079107863,PleasePrompto/notebooklm-skill,2810,mit,https://github.com/PleasePrompto/notebooklm-skill,"Use this skill to enable Claude Code to communicate directly with your Google NotebookLM notebooks. Query your uploaded documents and get source-grounded, citation-backed answers from Gemini. Features browser automation, library management, persistent authentication, and answers exclusively from your own knowledge base.",2025-10-19 13:36:13,2026-01-28 21:25:54,2026-01-28 21:31:12,PleasePrompto/notebooklm-skill,2809,mit,https://github.com/PleasePrompto/notebooklm-skill,"Use this skill to enable Claude Code to communicate directly with your Google NotebookLM notebooks. Query your uploaded documents and get source-grounded, citation-backed answers from Gemini. Features browser automation, library management, persistent authentication, and answers exclusively from your own knowledge base.",2025-10-19 13:36:13,2026-01-28 19:59:50,2026-01-28 21:23:30
1141853351,joeseesun/anything-to-notebooklm,273,mit,https://github.com/joeseesun/anything-to-notebooklm,"Claude Skill: Multi-source content processor for NotebookLM. Supports WeChat articles, web pages, YouTube, PDF, Markdown, search queries → Podcast/PPT/MindMap/Quiz etc.",2026-01-25 22:48:01,2026-01-28 21:25:53,2026-01-28 21:31:12,joeseesun/anything-to-notebooklm,272,mit,https://github.com/joeseesun/anything-to-notebooklm,"Claude Skill: Multi-source content processor for NotebookLM. Supports WeChat articles, web pages, YouTube, PDF, Markdown, search queries → Podcast/PPT/MindMap/Quiz etc.",2026-01-25 22:48:01,2026-01-28 19:55:45,2026-01-28 21:23:30
